{
  "$schema": "../schemas/evaluation.schema.json",
  "schema_version": "1.0.0", "capability_id": "reasoning-knowledge", "updated": "2026-08-24", "inherits": "../_shared/evaluation-policy.json",
  "suites": [
    {"id": "math-reasoning", "name": "MGSM and PolyMath", "source_url": "https://github.com/OpenEuroLLM/oellm-eval", "catalogue_entry": "birgermoell-oellm-eu-eval-holdouts-v1/0.0.0/README.md", "type": "project-holdout", "primary": true, "gate_class": "headline", "gate_eligible": true, "separation_evidence": "Use untouched project variants and record exact source-family overlap. Public MGSM/PolyMath scores are diagnostic if corresponding items or translations entered SFT/RLVR.", "runner": "oellm-eval", "language_scope": "EU24 and project target-language extensions", "metrics": [
      {"id": "mgsm-eu24", "name": "MGSM EU24", "unit": "score", "direction": "higher", "operator": ">=", "targets": {"9b": {"committed": 78, "stretch": 92}, "30b": {"committed": 88, "stretch": 92}}},
      {"id": "polymath", "name": "PolyMath", "unit": "score", "direction": "higher", "operator": ">=", "targets": {"9b": {"committed": 55, "stretch": 72}, "30b": {"committed": 68, "stretch": 72}}}
    ], "cadence": ["base", "after reasoning SFT", "every RLVR checkpoint", "release candidate"], "notes": "Report exact match, verifier agreement, language, difficulty tier, and generated-token cost."},
    {"id": "knowledge", "name": "MMLU-ProX and EU MMLU", "source_url": "https://github.com/OpenEuroLLM/oellm-eval", "catalogue_entry": "birgermoell-oellm-eu-eval-holdouts-v1/0.0.0/README.md", "type": "project-holdout", "primary": true, "gate_class": "headline", "gate_eligible": true, "separation_evidence": "Use evaluation-only rows and a source-family ledger. Global-MMLU and MMMLU catalogue copies used in earlier runs cannot gate unless exact non-overlap is demonstrated.", "runner": "oellm-eval", "language_scope": "EU24", "metrics": [{"id": "mmlu-prox-eu24", "name": "MMLU-ProX EU24 macro", "unit": "score", "direction": "higher", "operator": ">=", "targets": {"9b": {"committed": 50, "stretch": 72}, "30b": {"committed": 65, "stretch": 72}}}, {"id": "eu-mmlu-macro", "name": "EU MMLU macro", "unit": "score", "direction": "higher", "operator": ">=", "targets": {"9b": {"committed": 70, "stretch": 82}, "30b": {"committed": 78, "stretch": 82}}}], "cadence": ["base", "after SFT", "after RL", "release candidate"], "notes": "Report subject family, language, calibration, and abstention."},
    {"id": "hallucination", "name": "AA-Omni non-hallucination", "source_url": null, "catalogue_entry": null, "type": "public-benchmark", "primary": true, "gate_class": "release", "gate_eligible": false, "separation_evidence": "Benchmark revision and source overlap have not yet been pinned in the catalogue; use diagnostically until they are.", "runner": "custom", "language_scope": "English plus multilingual extensions", "metrics": [{"id": "non-hallucination", "name": "non-hallucination score", "unit": "score", "direction": "higher", "operator": ">=", "targets": {"9b": {"committed": 65, "stretch": 78}, "30b": {"committed": 72, "stretch": 78}}}], "cadence": ["base", "post SFT", "release candidate"], "notes": "Pair with factual calibration and unanswerable questions."},
    {"id": "frontier-diagnostics", "name": "GPQA and Humanity's Last Exam diagnostics", "source_url": null, "catalogue_entry": null, "type": "public-benchmark", "primary": false, "gate_class": "diagnostic", "gate_eligible": false, "separation_evidence": "High contamination risk and no clean project split; never use as the sole promotion gate.", "runner": "custom", "language_scope": "English", "metrics": [{"id": "accuracy", "name": "accuracy", "unit": "percent", "direction": "higher", "operator": ">=", "targets": {"9b": {"committed": null, "stretch": null}, "30b": {"committed": null, "stretch": null}}}], "cadence": ["major checkpoint"], "notes": "Use to understand ceiling and specialization interference, not to tune directly."}
  ],
  "stress_slices": ["final answer vs trace quality", "native vs English reasoning", "difficulty", "subject", "answerable vs unanswerable", "medical/factual high stakes", "quality per generated token", "specialist-vs-general regression"],
  "gaps": ["Clean multilingual verifier bank", "Pinned AA-Omni implementation", "Medical-reasoning safety case", "Native-language reasoning-trace evaluation"]
}
