{
  "$schema": "../schemas/evaluation.schema.json",
  "schema_version": "1.0.0", "capability_id": "multilingual", "updated": "2026-08-24", "inherits": "../_shared/evaluation-policy.json",
  "suites": [
    {"id": "knowledge-eu", "name": "MMLU-ProX, EU MMLU, MMMLU, and INCLUDE", "source_url": "https://github.com/OpenEuroLLM/oellm-eval", "catalogue_entry": "birgermoell-oellm-eu-eval-holdouts-v1/0.0.0/README.md", "type": "project-holdout", "primary": true, "gate_class": "headline", "gate_eligible": true, "separation_evidence": "Use the evaluation-only project bundle or another immutable clean split. Public Global-MMLU/MMMLU copies are diagnostic if any exact items entered earlier runs.", "runner": "oellm-eval", "language_scope": "EU24 plus release-language extensions", "metrics": [
      {"id": "mmlu-prox-eu24", "name": "MMLU-ProX EU24 macro", "unit": "score", "direction": "higher", "operator": ">=", "targets": {"9b": {"committed": 50, "stretch": 72}, "30b": {"committed": 65, "stretch": 72}}},
      {"id": "eu-mmlu-macro", "name": "EU MMLU macro", "unit": "score", "direction": "higher", "operator": ">=", "targets": {"9b": {"committed": 70, "stretch": 82}, "30b": {"committed": 78, "stretch": 82}}},
      {"id": "eu-mmlu-min", "name": "EU MMLU minimum language", "unit": "score", "direction": "higher", "operator": ">=", "targets": {"9b": {"committed": 55, "stretch": 72}, "30b": {"committed": 65, "stretch": 72}}},
      {"id": "mmmlu-eu24", "name": "MMMLU EU24 macro", "unit": "score", "direction": "higher", "operator": ">=", "targets": {"9b": {"committed": 68, "stretch": 80}, "30b": {"committed": 75, "stretch": 80}}},
      {"id": "include", "name": "INCLUDE score", "unit": "score", "direction": "higher", "operator": ">=", "targets": {"9b": {"committed": 74, "stretch": 82}, "30b": {"committed": 79, "stretch": 82}}}
    ], "cadence": ["base", "after multilingual SFT", "after every alignment stage", "release candidate"], "notes": "Public benchmark results must be labeled diagnostic wherever training overlap cannot be excluded."},
    {"id": "euroeval", "name": "EuroEval leaderboard", "source_url": "https://euroeval.com/", "catalogue_entry": null, "type": "public-benchmark", "primary": true, "gate_class": "headline", "gate_eligible": false, "separation_evidence": "External leaderboard is valuable for comparison, but test opacity, version drift, and possible source overlap prevent it from being the sole release gate.", "runner": "EuroEval", "language_scope": "supported European languages", "metrics": [{"id": "rank", "name": "overall leaderboard rank", "unit": "rank", "direction": "lower", "operator": "rank<=", "targets": {"9b": {"committed": 10, "stretch": 3}, "30b": {"committed": 5, "stretch": 3}}}], "cadence": ["major checkpoint", "release candidate"], "notes": "Record evaluation date, leaderboard version, compared model class, and per-language rank."},
    {"id": "translation", "name": "WMT24++ and FLORES diagnostic", "source_url": "https://github.com/OpenEuroLLM/oellm-eval", "catalogue_entry": "lumi-flores-200/0.0.0/README.md", "type": "public-benchmark", "primary": false, "gate_class": "diagnostic", "gate_eligible": false, "separation_evidence": "FLORES is explicitly evaluation-only, but public translation corpora may overlap pretraining; use for diagnosis and retain a private clean set for promotion.", "runner": "oellm-eval", "language_scope": "EU language pairs to/from English", "metrics": [{"id": "wmt24pp", "name": "WMT24++ score", "unit": "score", "direction": "higher", "operator": ">=", "targets": {"9b": {"committed": 83.5, "stretch": 85}, "30b": {"committed": 84, "stretch": 85}}}], "cadence": ["base", "post multilingual repair", "release candidate"], "notes": "Translation is a slice, not a proxy for general language usefulness."},
    {"id": "tier-parity", "name": "Language tier and fidelity audit", "source_url": null, "catalogue_entry": "birgermoell-oellm-eu-eval-holdouts-v1/0.0.0/README.md", "type": "project-holdout", "primary": true, "gate_class": "release", "gate_eligible": true, "separation_evidence": "Use unique protected prompts per language and keep translations, prompts, answers, and source passages outside all training builders.", "runner": "custom", "language_scope": "37 release locales / 36 language identities", "metrics": [
      {"id": "language-fidelity", "name": "response language fidelity", "unit": "percent", "direction": "higher", "operator": ">=", "targets": {"9b": {"committed": 98, "stretch": 99}, "30b": {"committed": 98, "stretch": 99}}},
      {"id": "macro-min-gap", "name": "macro to minimum-language gap", "unit": "percentage-points", "direction": "lower", "operator": "<=", "targets": {"9b": {"committed": 15, "stretch": 7}, "30b": {"committed": 10, "stretch": 7}}}
    ], "cadence": ["every multilingual checkpoint", "release candidate"], "notes": "Additionally enforce Tier 2 ≥90% of Tier 1 and Tier 3 ≥90% of Tier 2 on normalized comparable metrics."}
  ],
  "stress_slices": ["every language and script", "native vs translated prompts", "formal vs colloquial", "locale formatting", "code switching", "safety parity", "short and long context"],
  "gaps": ["Benchmark coverage for all 37 locales", "Immutable baseline on the selected base models", "Native-speaker adjudication for low-resource languages", "Single mapping between spreadsheet, oellm-eval, and FLORES codes"]
}
