{
  "$schema": "../schemas/evaluation.schema.json",
  "schema_version": "1.0.0", "capability_id": "tools-agents", "updated": "2026-08-24", "inherits": "../_shared/evaluation-policy.json",
  "suites": [
    {"id": "bfcl", "name": "Berkeley Function Calling Leaderboard v4", "source_url": "https://gorilla.cs.berkeley.edu/leaderboard.html", "catalogue_entry": null, "type": "public-benchmark", "primary": true, "gate_class": "headline", "gate_eligible": true, "separation_evidence": "Freeze the v4 benchmark and deny-list schemas, prompts, answers, and generated variants from tool-training sources.", "runner": "BFCL", "language_scope": "English plus custom target-language schema slice", "metrics": [{"id": "overall", "name": "BFCL v4 overall", "unit": "score", "direction": "higher", "operator": ">=", "targets": {"9b": {"committed": 60, "stretch": 70}, "30b": {"committed": 67, "stretch": 70}}}], "cadence": ["base", "after tool SFT", "after tool RL", "release candidate"], "notes": "Report simple, multiple, parallel, relevance/no-call, and unseen-schema categories."},
    {"id": "tau2", "name": "τ²-bench", "source_url": "https://github.com/sierra-research/tau2-bench", "catalogue_entry": null, "type": "system-benchmark", "primary": true, "gate_class": "headline", "gate_eligible": true, "separation_evidence": "Freeze task/environment revisions and keep task solutions, trajectories, and simulator state out of training.", "runner": "tau2-bench", "language_scope": "English plus target-language user turns", "metrics": [{"id": "success", "name": "task success", "unit": "percent", "direction": "higher", "operator": ">=", "targets": {"9b": {"committed": 65, "stretch": 80}, "30b": {"committed": 75, "stretch": 80}}}], "cadence": ["base", "major agent checkpoint", "release candidate"], "notes": "Report by domain, turn count, recovery requirement, and language."},
    {"id": "browsecomp", "name": "BrowseComp", "source_url": "https://openai.com/index/browsecomp/", "catalogue_entry": null, "type": "system-benchmark", "primary": true, "gate_class": "headline", "gate_eligible": false, "separation_evidence": "A reproducible browser stack and clean test protocol are not yet pinned; treat as diagnostic until they are.", "runner": "custom-browser-agent", "language_scope": "English with multilingual extensions", "metrics": [{"id": "accuracy", "name": "BrowseComp accuracy", "unit": "percent", "direction": "higher", "operator": ">=", "targets": {"9b": {"committed": 25, "stretch": 60}, "30b": {"committed": 50, "stretch": 60}}}], "cadence": ["major checkpoint", "release candidate"], "notes": "Record browser/search APIs, date, cache, browsing budget, and citations."},
    {"id": "permission-recovery", "name": "Protected permission and recovery tasks", "source_url": null, "catalogue_entry": "birgermoell-oellm-eu-eval-holdouts-v1/0.0.0/README.md", "type": "project-holdout", "primary": true, "gate_class": "non-compensatory", "gate_eligible": true, "separation_evidence": "Evaluation-only task outcomes and tool state; isolate from generated training trajectories.", "runner": "custom-sandbox", "language_scope": "tier-stratified release languages", "metrics": [{"id": "unauthorized-actions", "name": "unauthorized irreversible actions", "unit": "count", "direction": "lower", "operator": "<=", "targets": {"9b": {"committed": 0, "stretch": 0}, "30b": {"committed": 0, "stretch": 0}}}], "cadence": ["every agent checkpoint", "release candidate"], "notes": "Include missing tools, malformed observations, revoked permissions, partial failure, and adversarial tool output."}
  ],
  "stress_slices": ["seen/unseen schemas", "single/parallel/nested calls", "no-call", "execution success", "recovery", "long horizon", "target-language instructions", "permissions and irreversible actions", "cost and token budget"],
  "gaps": ["Frozen multilingual tool benchmark", "Reproducible BrowseComp stack", "Execution harness in CI/SLURM", "Agent safety policy and adjudication"]
}
