{
  "$schema": "../schemas/evaluation.schema.json",
  "schema_version": "1.0.0", "capability_id": "efficiency-release", "updated": "2026-08-24", "inherits": "../_shared/evaluation-policy.json",
  "suites": [
    {"id": "quantization-quality", "name": "Quantization quality preservation", "source_url": null, "catalogue_entry": "openeurollm-prelude-base-eval-scores/0.0.0/README.md", "type": "system-benchmark", "primary": true, "gate_class": "non-compensatory", "gate_eligible": true, "separation_evidence": "Run the same protected capability manifests on BF16 and every release quantization; calibration samples come only from recorded training strata.", "runner": "oellm-eval-plus-capability-runners", "language_scope": "all priority languages and capabilities", "metrics": [{"id": "macro-loss", "name": "maximum macro capability loss vs BF16", "unit": "percentage-points", "direction": "lower", "operator": "<=", "targets": {"9b": {"committed": 1, "stretch": 0.5}, "30b": {"committed": 1, "stretch": 0.5}}}, {"id": "slice-loss", "name": "maximum priority language/capability loss", "unit": "percentage-points", "direction": "lower", "operator": "<=", "targets": {"9b": {"committed": 2, "stretch": 1}, "30b": {"committed": 2, "stretch": 1}}}], "cadence": ["every release quantization", "release candidate"], "notes": "A good macro cannot compensate for a broken safety, language, tool, or structured-output slice."},
    {"id": "serving", "name": "Serving latency, throughput, memory, and stability", "source_url": null, "catalogue_entry": null, "type": "system-benchmark", "primary": true, "gate_class": "release", "gate_eligible": false, "separation_evidence": "Target hardware, engines, concurrency, sequence distributions, and SLOs are not yet selected.", "runner": "custom-serving-benchmark", "language_scope": "language-neutral token workload plus representative prompts", "metrics": [{"id": "latency-slo", "name": "requests meeting latency SLO", "unit": "percent", "direction": "higher", "operator": ">=", "targets": {"9b": {"committed": null, "stretch": null}, "30b": {"committed": null, "stretch": null}}}, {"id": "oom-rate", "name": "out-of-memory request rate", "unit": "percent", "direction": "lower", "operator": "<=", "targets": {"9b": {"committed": 0, "stretch": 0}, "30b": {"committed": 0, "stretch": 0}}}], "cadence": ["architecture milestone", "quantization candidate", "release candidate"], "notes": "Record engine revision, hardware, batch/concurrency, prompt/output lengths, TTFT, inter-token latency, tokens/s, memory, and energy if available."},
    {"id": "release-artifacts", "name": "Release artifact and provenance audit", "source_url": null, "catalogue_entry": null, "type": "audit", "primary": true, "gate_class": "non-compensatory", "gate_eligible": true, "separation_evidence": "Two-person review against immutable artifact hashes and signed release checklist.", "runner": "release-checklist", "language_scope": "all release variants", "metrics": [{"id": "required-artifacts", "name": "required release artifacts complete", "unit": "percent", "direction": "higher", "operator": ">=", "targets": {"9b": {"committed": 100, "stretch": 100}, "30b": {"committed": 100, "stretch": 100}}}], "cadence": ["release candidate", "final release"], "notes": "Require model card, data card references, license/provenance matrix, hashes, eval results, known limits, safety case, moderation guidance, serving recipe, quantizations, incident/canary plan, and signed approval."},
    {"id": "reproducibility", "name": "Independent evaluation reproduction", "source_url": "https://github.com/OpenEuroLLM/oellm-eval", "catalogue_entry": null, "type": "audit", "primary": true, "gate_class": "release", "gate_eligible": true, "separation_evidence": "A second operator reruns the locked manifest from model and container hashes without private conversational context.", "runner": "oellm-eval", "language_scope": "release headline suites", "metrics": [{"id": "reproduced", "name": "headline metrics reproduced within tolerance", "unit": "percent", "direction": "higher", "operator": ">=", "targets": {"9b": {"committed": 100, "stretch": 100}, "30b": {"committed": 100, "stretch": 100}}}], "cadence": ["final release candidate"], "notes": "Tolerance must be declared per metric before the rerun."}
  ],
  "stress_slices": ["BF16/FP8/INT8/INT4 or selected formats", "9B/30B", "short/128k/256k context", "batch and concurrency", "language tier", "JSON/tool calls", "reasoning length", "safety classifier on/off"],
  "gaps": ["Target engines and hardware", "Latency/throughput SLOs", "Release quantization list", "Named release owner and signatories", "Energy-measurement method"]
}
