{
  "$schema": "../schemas/evaluation.schema.json",
  "schema_version": "1.0.0", "capability_id": "instruction-chat", "updated": "2026-08-24", "inherits": "../_shared/evaluation-policy.json",
  "suites": [
    {"id": "instruction-following", "name": "IFEval, IFBench, and MAXIFE", "source_url": "https://github.com/OpenEuroLLM/oellm-eval", "catalogue_entry": "birgermoell-oellm-eu-eval-holdouts-v1/0.0.0/README.md", "type": "project-holdout", "primary": true, "gate_class": "headline", "gate_eligible": true, "separation_evidence": "Use clean project-held prompts and immutable public revisions; if translated or source items were used in training, remove that result from promotion decisions.", "runner": "oellm-eval-plus-custom", "language_scope": "English and all release-language adaptations", "metrics": [
      {"id": "ifeval", "name": "IFEval", "unit": "score", "direction": "higher", "operator": ">=", "targets": {"9b": {"committed": 75, "stretch": 90}, "30b": {"committed": 85, "stretch": 90}}},
      {"id": "ifbench", "name": "IFBench", "unit": "score", "direction": "higher", "operator": ">=", "targets": {"9b": {"committed": 60, "stretch": 76}, "30b": {"committed": 70, "stretch": 76}}},
      {"id": "maxife", "name": "MAXIFE", "unit": "score", "direction": "higher", "operator": ">=", "targets": {"9b": {"committed": 80, "stretch": 88}, "30b": {"committed": 85, "stretch": 88}}},
      {"id": "structured-output", "name": "valid constrained output", "unit": "percent", "direction": "higher", "operator": ">=", "targets": {"9b": {"committed": 99, "stretch": 99.5}, "30b": {"committed": 99, "stretch": 99.5}}}
    ], "cadence": ["base", "after SFT", "after preference/RL", "release candidate"], "notes": "Report strict and loose scoring, constraint type, language, and prompt-template sensitivity."},
    {"id": "oellm-arena", "name": "OpenEuroLLM multilingual arena", "source_url": "https://github.com/OpenEuroLLM/oellm-eval", "catalogue_entry": "openeurollm-arenahard-eu-v0-v0-bis/0.0.0/README.md", "type": "human-evaluation", "primary": true, "gate_class": "headline", "gate_eligible": true, "separation_evidence": "Evaluation-only prompts; freeze opponent pool, judge revision, prompt sampling, and language strata before model comparison.", "runner": "oellm-eval", "language_scope": "all supported release languages", "metrics": [{"id": "lower-ci-winrate", "name": "lower 95% CI of pairwise win rate", "unit": "percent", "direction": "higher", "operator": ">=", "targets": {"9b": {"committed": 50, "stretch": 55}, "30b": {"committed": 50, "stretch": 55}}}, {"id": "minimum-language-winrate", "name": "minimum-language win rate", "unit": "percent", "direction": "higher", "operator": ">=", "targets": {"9b": {"committed": 45, "stretch": 50}, "30b": {"committed": 45, "stretch": 50}}}], "cadence": ["major checkpoint", "release candidate"], "notes": "Blind pairwise evaluation with judge calibration and order randomization."},
    {"id": "lmarena", "name": "LMArena text leaderboard", "source_url": "https://lmarena.ai/leaderboard", "catalogue_entry": null, "type": "human-evaluation", "primary": true, "gate_class": "headline", "gate_eligible": false, "separation_evidence": "External live leaderboard provides a real-world target but its population, scoring, rank, and competitor set drift; snapshot the submission date and confidence interval and never make it the sole release gate.", "runner": "LMArena", "language_scope": "live traffic, primarily English; use OpenEuroLLM arena for language parity", "metrics": [{"id": "overall-rank", "name": "overall text leaderboard rank", "unit": "rank", "direction": "lower", "operator": "rank<=", "targets": {"9b": {"committed": 200, "stretch": 50}, "30b": {"committed": 100, "stretch": 50}}}, {"id": "arena-score", "name": "arena score", "unit": "score", "direction": "higher", "operator": ">=", "targets": {"9b": {"committed": 1346, "stretch": 1458}, "30b": {"committed": 1425, "stretch": 1458}}}], "cadence": ["one stable late checkpoint", "release candidate"], "notes": "Report rank together with score, confidence interval, date, style-control status, and model-size comparison set."},
    {"id": "arena-hard", "name": "Arena-Hard v2", "source_url": "https://github.com/lm-sys/arena-hard-auto", "catalogue_entry": "openeurollm-arenahard-eu-v0-v0-bis/0.0.0/README.md", "type": "public-benchmark", "primary": false, "gate_class": "headline", "gate_eligible": false, "separation_evidence": "Useful external comparison, but public prompt exposure and judge drift require diagnostic treatment unless a clean frozen subset is documented.", "runner": "custom", "language_scope": "English plus ArenaHard-EU", "metrics": [{"id": "score", "name": "Arena-Hard v2 score", "unit": "score", "direction": "higher", "operator": ">=", "targets": {"9b": {"committed": 25, "stretch": 55}, "30b": {"committed": 45, "stretch": 55}}}], "cadence": ["major checkpoint", "release candidate"], "notes": "Pin judge model, reference answers, and scoring code."},
    {"id": "chat-quality-audit", "name": "Multi-turn chat quality audit", "source_url": null, "catalogue_entry": "birgermoell-oellm-eu-eval-holdouts-v1/0.0.0/README.md", "type": "human-evaluation", "primary": false, "gate_class": "release", "gate_eligible": true, "separation_evidence": "Protected conversations and rubric; no conversation or derivative may enter preference data.", "runner": "custom-human-review", "language_scope": "tier-stratified release languages", "metrics": [{"id": "critical-dialogue-failures", "name": "critical dialogue failures", "unit": "count", "direction": "lower", "operator": "<=", "targets": {"9b": {"committed": 0, "stretch": 0}, "30b": {"committed": 0, "stretch": 0}}}], "cadence": ["post SFT", "release candidate"], "notes": "Assess directness, calibration, constraint retention, correction, loop recovery, sycophancy, and refusal calibration."}
  ],
  "stress_slices": ["single vs multi-turn", "nested constraints", "JSON/XML/code fences", "ambiguous requests", "self-correction", "all language tiers", "benign safety-adjacent prompts"],
  "gaps": ["Frozen multilingual IFEval/IFBench/MAXIFE adaptations", "Arena judge calibration in lower-resource languages", "Named chat/style owner"]
}
