{
  "$schema": "../schemas/evaluation.schema.json",
  "schema_version": "1.0.0", "capability_id": "long-context", "updated": "2026-08-24", "inherits": "../_shared/evaluation-policy.json",
  "suites": [
    {"id": "retrieval-precondition", "name": "RULER and needle-in-a-haystack precondition", "source_url": null, "catalogue_entry": null, "type": "system-benchmark", "primary": true, "gate_class": "release", "gate_eligible": true, "separation_evidence": "Generate fresh deterministic keys/content per run, publish generator seed and hashes, and keep generated instances out of training.", "runner": "custom-long-context", "language_scope": "English and tier-stratified multilingual variants", "metrics": [{"id": "retrieval", "name": "retrieval success through advertised context", "unit": "percent", "direction": "higher", "operator": ">=", "targets": {"9b": {"committed": 95, "stretch": 99}, "30b": {"committed": 95, "stretch": 99}}}], "cadence": ["every context-extension checkpoint", "release candidate at 128k and 256k"], "notes": "This is a precondition, not evidence of useful long-document reasoning."},
    {"id": "mrcr", "name": "MRCR at 128k", "source_url": null, "catalogue_entry": null, "type": "public-benchmark", "primary": true, "gate_class": "headline", "gate_eligible": true, "separation_evidence": "Pin benchmark revision and prohibit exact tasks, generated variants, and source documents from training.", "runner": "custom-long-context", "language_scope": "English plus multilingual adaptations", "metrics": [{"id": "score-128k", "name": "MRCR 128k", "unit": "score", "direction": "higher", "operator": ">=", "targets": {"9b": {"committed": 35, "stretch": 67}, "30b": {"committed": 55, "stretch": 67}}}], "cadence": ["64k/128k milestone", "post SFT", "release candidate"], "notes": "Also report length curve and position buckets."},
    {"id": "longbench-v2", "name": "LongBench v2", "source_url": "https://github.com/THUDM/LongBench", "catalogue_entry": null, "type": "public-benchmark", "primary": true, "gate_class": "headline", "gate_eligible": true, "separation_evidence": "Freeze revision and source-document hashes; exclude benchmark documents and derivatives from training mixtures.", "runner": "custom-long-context", "language_scope": "benchmark languages plus project extensions", "metrics": [{"id": "score", "name": "LongBench v2", "unit": "score", "direction": "higher", "operator": ">=", "targets": {"9b": {"committed": 50, "stretch": 61}, "30b": {"committed": 58, "stretch": 61}}}], "cadence": ["base", "after context extension", "post SFT", "release candidate"], "notes": "Report task type, length, language, and answer format."},
    {"id": "serving-and-preservation", "name": "Long-context serving and short-context preservation", "source_url": null, "catalogue_entry": null, "type": "system-benchmark", "primary": true, "gate_class": "non-compensatory", "gate_eligible": true, "separation_evidence": "Use fixed production-like traces and the same short-context protected suite across parent and candidate.", "runner": "custom-serving-plus-oellm-eval", "language_scope": "all priority languages", "metrics": [{"id": "short-context-regression", "name": "maximum priority-language short-context regression", "unit": "percentage-points", "direction": "lower", "operator": "<=", "targets": {"9b": {"committed": 2, "stretch": 1}, "30b": {"committed": 2, "stretch": 1}}}], "cadence": ["every context-length promotion", "release candidate"], "notes": "Also record memory, time-to-first-token, throughput, OOM rate, and cache implementation at 128k and 256k."}
  ],
  "stress_slices": ["16k/32k/64k/128k/256k", "beginning/middle/end evidence", "single retrieval vs synthesis", "multilingual documents", "long instruction following", "tool use", "distractors", "short-context regression", "serving stability"],
  "gaps": ["Pinned MRCR revision", "Protected multilingual synthesis set", "256k serving SLO", "Experimental 512k+ promotion criteria"]
}
