{
  "$schema": "../schemas/evaluation.schema.json",
  "schema_version": "1.0.0", "capability_id": "grounding-rag", "updated": "2026-08-24", "inherits": "../_shared/evaluation-policy.json",
  "suites": [
    {"id": "rag-holdout", "name": "OpenEuroLLM multilingual RAG holdout", "source_url": null, "catalogue_entry": "birgermoell-oellm-eu-eval-holdouts-v1/0.0.0/README.md", "type": "project-holdout", "primary": true, "gate_class": "release", "gate_eligible": true, "separation_evidence": "Use protected documents, queries, answers, and citation spans. Split by source document and source family, never by generated QA row.", "runner": "custom-rag-eval", "language_scope": "tier-stratified release languages", "metrics": [
      {"id": "answer-correctness", "name": "answerable correctness delta vs parent", "unit": "percentage-points", "direction": "higher", "operator": ">=", "targets": {"9b": {"committed": null, "stretch": null}, "30b": {"committed": null, "stretch": null}}},
      {"id": "no-answer-correctness", "name": "unanswerable correctness delta vs parent", "unit": "percentage-points", "direction": "higher", "operator": ">=", "targets": {"9b": {"committed": null, "stretch": null}, "30b": {"committed": null, "stretch": null}}},
      {"id": "unsupported-critical", "name": "unsupported critical claims", "unit": "count", "direction": "lower", "operator": "<=", "targets": {"9b": {"committed": 0, "stretch": 0}, "30b": {"committed": 0, "stretch": 0}}}
    ], "cadence": ["base", "after grounded SFT", "after preference/RL", "release candidate"], "notes": "Both answerable and unanswerable metrics must improve strictly against the parent without an abstention collapse; set numeric floors after the immutable base run."},
    {"id": "citation", "name": "Citation precision, recall, and claim support", "source_url": null, "catalogue_entry": "birgermoell-oellm-eu-eval-holdouts-v1/0.0.0/README.md", "type": "project-holdout", "primary": true, "gate_class": "headline", "gate_eligible": true, "separation_evidence": "Human-verified protected claim/span annotations with document hashes and adjudicator agreement.", "runner": "custom-claim-verifier", "language_scope": "all sampled release languages", "metrics": [{"id": "citation-precision", "name": "citation precision", "unit": "percent", "direction": "higher", "operator": ">=", "targets": {"9b": {"committed": null, "stretch": null}, "30b": {"committed": null, "stretch": null}}}, {"id": "citation-recall", "name": "citation recall", "unit": "percent", "direction": "higher", "operator": ">=", "targets": {"9b": {"committed": null, "stretch": null}, "30b": {"committed": null, "stretch": null}}}], "cadence": ["base", "every grounding checkpoint", "release candidate"], "notes": "Set absolute floors after the base baseline and inter-annotator calibration."},
    {"id": "retrieval-generation-attribution", "name": "Retriever/generator attribution matrix", "source_url": null, "catalogue_entry": null, "type": "system-benchmark", "primary": false, "gate_class": "diagnostic", "gate_eligible": false, "separation_evidence": "Benchmark construction and retriever set are not yet frozen.", "runner": "custom-rag-eval", "language_scope": "tier-stratified", "metrics": [{"id": "end-to-end-correctness", "name": "end-to-end correctness", "unit": "percent", "direction": "higher", "operator": ">=", "targets": {"9b": {"committed": null, "stretch": null}, "30b": {"committed": null, "stretch": null}}}], "cadence": ["major checkpoint"], "notes": "Cross good/bad retrieval with parent/candidate generators to locate failures."}
  ],
  "stress_slices": ["answerable/unanswerable", "single/multiple/conflicting sources", "fresh/stale evidence", "numeric and high-stakes claims", "retrieval language differs from answer language", "long documents", "adversarial irrelevant passages"],
  "gaps": ["Protected multilingual document/query set", "Citation metric floors after baseline", "Frozen retriever and index configurations", "Human claim-support adjudication guide"]
}
