{
  "$schema": "../schemas/evaluation.schema.json",
  "schema_version": "1.0.0", "capability_id": "coding", "updated": "2026-08-24", "inherits": "../_shared/evaluation-policy.json",
  "suites": [
    {"id": "livecodebench", "name": "LiveCodeBench", "source_url": "https://github.com/LiveCodeBench/LiveCodeBench", "catalogue_entry": null, "type": "public-benchmark", "primary": true, "gate_class": "headline", "gate_eligible": true, "separation_evidence": "Use a time-based slice newer than every training source cutoff; record problems, dates, repository revision, execution image, and deny-list hashes.", "runner": "LiveCodeBench", "language_scope": "English prompts, multiple programming languages", "metrics": [{"id": "pass1", "name": "pass@1", "unit": "percent", "direction": "higher", "operator": ">=", "targets": {"9b": {"committed": 55, "stretch": 80}, "30b": {"committed": 70, "stretch": 80}}}], "cadence": ["base", "post code SFT", "every code RL milestone", "release candidate"], "notes": "Coding remains P2 and diagnostic until a dedicated owner/data route is approved; 80 is a stretch goal only under that route."},
    {"id": "evalplus", "name": "EvalPlus", "source_url": "https://github.com/evalplus/evalplus", "catalogue_entry": null, "type": "public-benchmark", "primary": false, "gate_class": "diagnostic", "gate_eligible": false, "separation_evidence": "Public benchmark repositories are contamination-prone; use diagnostically unless exact repository and derivative exclusion is demonstrated.", "runner": "EvalPlus", "language_scope": "English/Python", "metrics": [{"id": "pass1", "name": "pass@1", "unit": "percent", "direction": "higher", "operator": ">=", "targets": {"9b": {"committed": null, "stretch": null}, "30b": {"committed": null, "stretch": null}}}], "cadence": ["major checkpoint"], "notes": "Report HumanEval+ and MBPP+ separately."},
    {"id": "defect-repair", "name": "Protected multilingual defect-repair holdout", "source_url": null, "catalogue_entry": "birgermoell-oellm-eu-eval-holdouts-v1/0.0.0/README.md", "type": "project-holdout", "primary": true, "gate_class": "release", "gate_eligible": true, "separation_evidence": "Use held-out repositories/tasks with no shared bug, patch, issue text, test, or generated derivative in training.", "runner": "custom-sandbox", "language_scope": "tier-stratified natural-language prompts and multiple programming languages", "metrics": [{"id": "tests-passed", "name": "tasks with all tests passed", "unit": "percent", "direction": "higher", "operator": ">=", "targets": {"9b": {"committed": null, "stretch": null}, "30b": {"committed": null, "stretch": null}}}], "cadence": ["base", "post code training", "release candidate"], "notes": "Set floors after the base run; report language, code language, defect class, and tool use."},
    {"id": "secure-coding", "name": "Secure coding audit", "source_url": null, "catalogue_entry": null, "type": "audit", "primary": true, "gate_class": "non-compensatory", "gate_eligible": false, "separation_evidence": "Threat model and protected task set are not yet approved.", "runner": "custom-security-harness", "language_scope": "English plus target-language instructions", "metrics": [{"id": "critical-vulnerabilities", "name": "critical vulnerabilities introduced", "unit": "count", "direction": "lower", "operator": "<=", "targets": {"9b": {"committed": 0, "stretch": 0}, "30b": {"committed": 0, "stretch": 0}}}], "cadence": ["post code training", "release candidate"], "notes": "Cover secrets, injection, unsafe deserialization, auth, permissions, and dependency handling."}
  ],
  "stress_slices": ["generation vs repair", "Python and non-Python", "unit tests vs hidden tests", "terminal tool use", "multilingual instructions", "security", "time-based contamination", "instruction and reasoning regression"],
  "gaps": ["Named coding lead", "Protected repository repair suite", "Secure-coding threat model", "Pinned execution images and dependency policy"]
}
